{
  "version": "partial-profile-notes-v1",
  "as_of": "2026-03-23T09:01:00Z",
  "profile": {
    "category_profiles": [
      {
        "category": "accessories",
        "preferences": {
          "colors": [
            "brown",
            "black",
            "olive"
          ],
          "patterns": []
        }
      },
      {
        "category": "hats",
        "preferences": {
          "colors": [
            "navy",
            "olive",
            "charcoal"
          ]
        },
        "default_size": null
      },
      {
        "category": "pants",
        "scoped_overrides": [
          {
            "context": {
              "subtype": null,
              "season": "summer",
              "occasion": null
            },
            "preferences": {
              "materials": [
                "linen",
                "cotton"
              ]
            }
          }
        ],
        "preferences": {
          "patterns": [
            "solid"
          ]
        }
      },
      {
        "category": "shirts",
        "scoped_overrides": [
          {
            "context": {
              "subtype": null,
              "season": "summer",
              "occasion": null
            },
            "preferences": {
              "fits": [
                "relaxed"
              ],
              "patterns": []
            }
          }
        ]
      },
      {
        "category": "shoes",
        "preferences": {
          "cuts": [
            "low-top"
          ]
        }
      }
    ],
    "purchase_intents": [
      {
        "id": "urgent-gift",
        "category": "shirts",
        "recipient": "gift",
        "status": "cancelled",
        "deadline": "2026-03-02T18:00:00Z"
      },
      {
        "id": "future-trip",
        "category": "shoes",
        "recipient": "self",
        "status": "active",
        "deadline": "2026-05-01T18:00:00Z"
      }
    ],
    "personal": {
      "name": "Evan Mercer"
    }
  },
  "history": [
    {
      "address": {
        "section": "clothing",
        "category": "accessories",
        "field": "colors",
        "context": {}
      },
      "events": [
        {
          "at": "2026-03-13T09:00:02Z",
          "until": null,
          "value": [
            "brown",
            "black",
            "olive"
          ]
        }
      ]
    },
    {
      "address": {
        "section": "clothing",
        "category": "accessories",
        "field": "patterns",
        "context": {}
      },
      "events": [
        {
          "at": "2026-03-01T09:00:03Z",
          "until": null,
          "value": []
        }
      ]
    },
    {
      "address": {
        "section": "clothing",
        "category": "hats",
        "field": "colors",
        "context": {}
      },
      "events": [
        {
          "at": "2026-03-13T09:00:01Z",
          "until": null,
          "value": [
            "navy",
            "olive",
            "charcoal"
          ]
        }
      ]
    },
    {
      "address": {
        "section": "clothing",
        "category": "hats",
        "field": "default_size",
        "context": {}
      },
      "events": [
        {
          "at": "2026-03-01T09:00:02Z",
          "until": null,
          "value": null
        }
      ]
    },
    {
      "address": {
        "section": "clothing",
        "category": "pants",
        "field": "materials",
        "context": {
          "season": "summer"
        }
      },
      "events": [
        {
          "at": "2026-03-01T09:00:01Z",
          "until": null,
          "value": [
            "linen",
            "cotton"
          ]
        },
        {
          "at": "2026-03-06T09:00:00Z",
          "until": "2026-03-09T09:00:00Z",
          "value": []
        }
      ]
    },
    {
      "address": {
        "section": "clothing",
        "category": "pants",
        "field": "patterns",
        "context": {}
      },
      "events": [
        {
          "at": "2026-03-23T09:00:01Z",
          "until": null,
          "value": [
            "solid"
          ]
        }
      ]
    },
    {
      "address": {
        "section": "clothing",
        "category": "shirts",
        "field": "fits",
        "context": {
          "season": "summer"
        }
      },
      "events": [
        {
          "at": "2026-03-11T09:00:00Z",
          "until": null,
          "value": [
            "relaxed"
          ]
        }
      ]
    },
    {
      "address": {
        "section": "clothing",
        "category": "shirts",
        "field": "patterns",
        "context": {
          "season": "summer"
        }
      },
      "events": [
        {
          "at": "2026-03-06T09:00:01Z",
          "until": null,
          "value": [
            "solid"
          ]
        },
        {
          "at": "2026-03-13T09:00:00Z",
          "until": null,
          "value": []
        }
      ]
    },
    {
      "address": {
        "section": "intent",
        "field": "state",
        "intent_id": "urgent-gift",
        "category": "shirts",
        "recipient": "gift"
      },
      "events": [
        {
          "at": "2026-03-01T09:00:05Z",
          "until": null,
          "value": {
            "status": "active",
            "deadline": "2026-03-02T18:00:00Z"
          }
        },
        {
          "at": "2026-03-23T09:00:00Z",
          "until": null,
          "value": {
            "status": "cancelled",
            "deadline": "2026-03-02T18:00:00Z"
          }
        }
      ]
    },
    {
      "address": {
        "section": "clothing",
        "category": "shoes",
        "field": "cuts",
        "context": {}
      },
      "events": [
        {
          "at": "2026-03-01T09:00:06Z",
          "until": null,
          "value": [
            "low-top"
          ]
        }
      ]
    },
    {
      "address": {
        "section": "intent",
        "field": "state",
        "intent_id": "future-trip",
        "category": "shoes",
        "recipient": "self"
      },
      "events": [
        {
          "at": "2026-03-01T09:00:04Z",
          "until": null,
          "value": {
            "status": "active",
            "deadline": "2026-05-01T18:00:00Z"
          }
        }
      ]
    },
    {
      "address": {
        "section": "personal",
        "field": "name"
      },
      "events": [
        {
          "at": "2026-03-01T09:00:00Z",
          "until": null,
          "value": "Evan Mercer"
        }
      ]
    }
  ]
}
