{
  "version": "partial-profile-notes-v1",
  "as_of": "2026-03-01T09:01:00Z",
  "profile": {
    "category_profiles": [
      {
        "category": "outerwear",
        "sizes": [
          {
            "brand": "Patagonia",
            "sizing_system": "ALPHA",
            "size": "S"
          }
        ]
      },
      {
        "category": "accessories",
        "preferences": {
          "patterns": []
        }
      },
      {
        "category": "hats",
        "default_size": null
      },
      {
        "category": "pants",
        "scoped_overrides": [
          {
            "context": {
              "subtype": null,
              "season": "summer",
              "occasion": null
            },
            "preferences": {
              "materials": [
                "linen",
                "cotton"
              ]
            }
          }
        ]
      }
    ],
    "purchase_intents": [
      {
        "id": "urgent-gift",
        "category": "shirts",
        "recipient": "gift",
        "status": "active",
        "deadline": "2026-03-02T18:00:00Z"
      },
      {
        "id": "future-trip",
        "category": "shoes",
        "recipient": "self",
        "status": "active",
        "deadline": "2026-05-01T18:00:00Z"
      }
    ],
    "personal": {
      "name": "Valeria Hernández"
    }
  },
  "history": [
    {
      "address": {
        "section": "clothing",
        "category": "outerwear",
        "field": "brand_size",
        "context": {},
        "brand": "Patagonia",
        "sizing_system": "ALPHA"
      },
      "events": [
        {
          "at": "2026-03-01T09:00:06Z",
          "until": null,
          "value": "S"
        }
      ]
    },
    {
      "address": {
        "section": "clothing",
        "category": "accessories",
        "field": "patterns",
        "context": {}
      },
      "events": [
        {
          "at": "2026-03-01T09:00:03Z",
          "until": null,
          "value": []
        }
      ]
    },
    {
      "address": {
        "section": "clothing",
        "category": "hats",
        "field": "default_size",
        "context": {}
      },
      "events": [
        {
          "at": "2026-03-01T09:00:02Z",
          "until": null,
          "value": null
        }
      ]
    },
    {
      "address": {
        "section": "clothing",
        "category": "pants",
        "field": "materials",
        "context": {
          "season": "summer"
        }
      },
      "events": [
        {
          "at": "2026-03-01T09:00:01Z",
          "until": null,
          "value": [
            "linen",
            "cotton"
          ]
        }
      ]
    },
    {
      "address": {
        "section": "intent",
        "field": "state",
        "intent_id": "urgent-gift",
        "category": "shirts",
        "recipient": "gift"
      },
      "events": [
        {
          "at": "2026-03-01T09:00:05Z",
          "until": null,
          "value": {
            "status": "active",
            "deadline": "2026-03-02T18:00:00Z"
          }
        }
      ]
    },
    {
      "address": {
        "section": "intent",
        "field": "state",
        "intent_id": "future-trip",
        "category": "shoes",
        "recipient": "self"
      },
      "events": [
        {
          "at": "2026-03-01T09:00:04Z",
          "until": null,
          "value": {
            "status": "active",
            "deadline": "2026-05-01T18:00:00Z"
          }
        }
      ]
    },
    {
      "address": {
        "section": "personal",
        "field": "name"
      },
      "events": [
        {
          "at": "2026-03-01T09:00:00Z",
          "until": null,
          "value": "Valeria Hernández"
        }
      ]
    }
  ]
}
