{
  "version": "partial-profile-notes-v1",
  "as_of": "2026-04-11T09:01:00Z",
  "profile": {
    "general_preferences": [
      {
        "topic": "clothing",
        "item": "visible brand logos",
        "scope": "global",
        "category": null,
        "stance": "dislike"
      }
    ],
    "category_profiles": [
      {
        "category": "accessories",
        "preferences": {
          "occasions": [
            "work",
            "travel",
            "casual"
          ],
          "patterns": [
            "plain",
            "striped"
          ],
          "styles": [
            "minimalist",
            "functional"
          ]
        }
      },
      {
        "category": "hats",
        "preferences": {
          "colors": [
            "navy",
            "olive"
          ]
        },
        "default_size": null
      },
      {
        "category": "outerwear",
        "preferences": {
          "brands": [],
          "patterns": []
        }
      },
      {
        "category": "pants",
        "scoped_overrides": [
          {
            "context": {
              "subtype": null,
              "season": "summer",
              "occasion": null
            },
            "preferences": {
              "materials": [
                "linen",
                "cotton"
              ]
            }
          }
        ]
      },
      {
        "category": "shirts",
        "preferences": {
          "brands": [
            "Aster"
          ]
        }
      },
      {
        "category": "shoes",
        "preferences": {
          "colors": [
            "white",
            "black",
            "tan"
          ]
        }
      }
    ],
    "purchase_intents": [
      {
        "id": "urgent-gift",
        "category": "shirts",
        "recipient": "gift",
        "status": "completed",
        "deadline": "2026-03-02T18:00:00Z"
      },
      {
        "id": "future-trip",
        "category": "shoes",
        "recipient": "self",
        "status": "active",
        "deadline": "2026-05-01T18:00:00Z"
      }
    ],
    "personal": {
      "birth_date": "1991-08-14",
      "name": "Nora Lindholm"
    },
    "physical": {
      "build": "medium"
    },
    "professional": {
      "income": {
        "amount": 48000,
        "currency": "SEK",
        "period": "year"
      }
    }
  },
  "history": [
    {
      "address": {
        "section": "preference",
        "field": "stance",
        "topic": "clothing",
        "item": "visible brand logos",
        "scope": "global",
        "category": null
      },
      "events": [
        {
          "at": "2026-03-26T09:00:02Z",
          "until": null,
          "value": "dislike"
        }
      ]
    },
    {
      "address": {
        "section": "clothing",
        "category": "accessories",
        "field": "occasions",
        "context": {}
      },
      "events": [
        {
          "at": "2026-03-11T09:00:00Z",
          "until": null,
          "value": [
            "work",
            "travel",
            "casual"
          ]
        }
      ]
    },
    {
      "address": {
        "section": "clothing",
        "category": "accessories",
        "field": "patterns",
        "context": {}
      },
      "events": [
        {
          "at": "2026-03-01T09:00:03Z",
          "until": null,
          "value": []
        },
        {
          "at": "2026-03-31T09:00:00Z",
          "until": null,
          "value": [
            "plain",
            "striped"
          ]
        }
      ]
    },
    {
      "address": {
        "section": "clothing",
        "category": "accessories",
        "field": "styles",
        "context": {}
      },
      "events": [
        {
          "at": "2026-04-10T09:00:00Z",
          "until": null,
          "value": [
            "minimalist",
            "functional"
          ]
        }
      ]
    },
    {
      "address": {
        "section": "clothing",
        "category": "hats",
        "field": "colors",
        "context": {}
      },
      "events": [
        {
          "at": "2026-03-31T09:00:02Z",
          "until": null,
          "value": [
            "navy",
            "olive"
          ]
        }
      ]
    },
    {
      "address": {
        "section": "clothing",
        "category": "hats",
        "field": "default_size",
        "context": {}
      },
      "events": [
        {
          "at": "2026-03-01T09:00:02Z",
          "until": null,
          "value": null
        }
      ]
    },
    {
      "address": {
        "section": "clothing",
        "category": "outerwear",
        "field": "brands",
        "context": {}
      },
      "events": [
        {
          "at": "2026-03-01T09:00:06Z",
          "until": null,
          "value": [
            "Rains",
            "Patagonia"
          ]
        },
        {
          "at": "2026-03-16T09:00:00Z",
          "until": null,
          "value": []
        }
      ]
    },
    {
      "address": {
        "section": "clothing",
        "category": "outerwear",
        "field": "patterns",
        "context": {}
      },
      "events": [
        {
          "at": "2026-03-31T09:00:01Z",
          "until": null,
          "value": []
        }
      ]
    },
    {
      "address": {
        "section": "clothing",
        "category": "pants",
        "field": "materials",
        "context": {
          "season": "summer"
        }
      },
      "events": [
        {
          "at": "2026-03-01T09:00:01Z",
          "until": null,
          "value": [
            "linen",
            "cotton"
          ]
        },
        {
          "at": "2026-03-06T09:00:00Z",
          "until": "2026-03-09T09:00:00Z",
          "value": []
        }
      ]
    },
    {
      "address": {
        "section": "clothing",
        "category": "shirts",
        "field": "brands",
        "context": {}
      },
      "events": [
        {
          "at": "2026-03-26T09:00:01Z",
          "until": null,
          "value": [
            "Arket",
            "Uniqlo"
          ]
        },
        {
          "at": "2026-04-11T09:00:00Z",
          "until": null,
          "value": [
            "Aster"
          ]
        }
      ]
    },
    {
      "address": {
        "section": "intent",
        "field": "state",
        "intent_id": "urgent-gift",
        "category": "shirts",
        "recipient": "gift"
      },
      "events": [
        {
          "at": "2026-03-01T09:00:05Z",
          "until": null,
          "value": {
            "status": "active",
            "deadline": "2026-03-02T18:00:00Z"
          }
        },
        {
          "at": "2026-03-26T09:00:00Z",
          "until": null,
          "value": {
            "status": "completed",
            "deadline": "2026-03-02T18:00:00Z"
          }
        }
      ]
    },
    {
      "address": {
        "section": "clothing",
        "category": "shoes",
        "field": "colors",
        "context": {}
      },
      "events": [
        {
          "at": "2026-04-11T09:00:02Z",
          "until": null,
          "value": [
            "white",
            "black",
            "tan"
          ]
        }
      ]
    },
    {
      "address": {
        "section": "intent",
        "field": "state",
        "intent_id": "future-trip",
        "category": "shoes",
        "recipient": "self"
      },
      "events": [
        {
          "at": "2026-03-01T09:00:04Z",
          "until": null,
          "value": {
            "status": "active",
            "deadline": "2026-05-01T18:00:00Z"
          }
        }
      ]
    },
    {
      "address": {
        "section": "personal",
        "field": "birth_date"
      },
      "events": [
        {
          "at": "2026-04-11T09:00:01Z",
          "until": null,
          "value": "1991-08-14"
        }
      ]
    },
    {
      "address": {
        "section": "physical",
        "field": "build"
      },
      "events": [
        {
          "at": "2026-03-16T09:00:01Z",
          "until": null,
          "value": "medium"
        }
      ]
    },
    {
      "address": {
        "section": "general",
        "field": "income"
      },
      "events": [
        {
          "at": "2026-03-06T09:00:01Z",
          "until": null,
          "value": {
            "amount": 48000,
            "currency": "SEK",
            "period": "year"
          }
        }
      ]
    },
    {
      "address": {
        "section": "personal",
        "field": "name"
      },
      "events": [
        {
          "at": "2026-03-01T09:00:00Z",
          "until": null,
          "value": "Nora Lindholm"
        }
      ]
    }
  ]
}
